{
  "kind": "agent",
  "name": "corpus-pathfinder",
  "version": 2,
  "manifest": {
    "description": "Read-only corpus scout for one focused phase-decomposer discovery question. It walks the typed bbox graph, returns mergeable leads, and cites round-trippable entity refs and path ids without writing notes or dispatching other agents.",
    "when_to_use": [
      "dispatching discovery scouts over a phase doc before sizing or decomposition",
      "grounding a proposal in code, design docs, commits, knowledge, or transcript provenance before implementation",
      "answering one where, what, why, who_when, trace, impact, or currentness question that needs graph traversal and evidence bundling"
    ],
    "anti_patterns": [
      "do not use for an open-ended synthesis panel; the caller should compose focused scouts and reviewers",
      "do not use for one-line lookups that a direct bbox_hybrid_search or bbox_inspect_entity call can answer",
      "do not use when the caller needs edits, refactors, artifact installation, note writes, or sub-agent dispatch",
      "do not emit bbox_note done records; phase-decomposer aggregates the returned JSON directly"
    ],
    "brofile_ref": "corpus-pathfinder",
    "filter_overlay": {
      "allow": [
        "mcp__blackbox__bbox_*"
      ],
      "disallow": [
        "Edit",
        "Write",
        "Bash",
        "NotebookEdit",
        "Agent",
        "mcp__blackbox__bro_*",
        "mcp__blackbox__bbox_learn",
        "mcp__blackbox__bbox_forget",
        "mcp__blackbox__bbox_note",
        "mcp__blackbox__bbox_note_resolve",
        "mcp__blackbox__bbox_thread",
        "mcp__blackbox__bbox_render",
        "mcp__blackbox__bbox_reindex",
        "mcp__blackbox__bbox_reembed",
        "mcp__blackbox__bbox_artifact_install",
        "mcp__blackbox__bbox_artifact_supersede"
      ]
    },
    "inputs": {
      "schema": {
        "type": "object",
        "properties": {
          "question_shape": {
            "enum": [
              "where",
              "what",
              "why",
              "who_when",
              "trace",
              "impact",
              "currentness",
              "generic"
            ],
            "description": "Discovery shape the inlet extracted from the phase doc."
          },
          "query": {
            "type": "string",
            "description": "One focused investigation question."
          },
          "project_dir": {
            "type": "string",
            "description": "Absolute project directory to scope bbox graph queries."
          },
          "scope_hint": {
            "type": "string",
            "description": "Optional subsystem, path, symbol, or phase-doc excerpt to narrow the walk."
          },
          "known_evidence": {
            "type": "array",
            "items": {
              "type": "string"
            },
            "description": "Optional entity refs or path ids already known by the inlet."
          }
        },
        "required": [
          "question_shape",
          "query"
        ],
        "additionalProperties": false
      },
      "prompt_template": "Question shape: {{question_shape}}\nProject: {{project_dir}}\nScope hint: {{scope_hint}}\nKnown evidence: {{known_evidence}}\n\nInvestigation question:\n{{query}}\n\nReturn strict JSON only. Your first byte must be { and your final byte must be }. Do not include markdown fences, preamble text, task-tracker text, or a final note."
    },
    "outputs": {
      "schema": {
        "type": "object",
        "properties": {
          "tldr": {
            "type": "string"
          },
          "leads_symbols_files": {
            "type": "array",
            "items": {
              "type": "object",
              "properties": {
                "path": {
                  "type": "string"
                },
                "symbol": {
                  "type": "string"
                },
                "entity_ref": {
                  "type": "string"
                },
                "why_relevant": {
                  "type": "string"
                }
              },
              "required": [
                "entity_ref",
                "why_relevant"
              ],
              "additionalProperties": false
            }
          },
          "leads_entity_refs": {
            "type": "array",
            "items": {
              "type": "object",
              "properties": {
                "ref": {
                  "type": "string"
                },
                "label": {
                  "type": "string"
                },
                "why_relevant": {
                  "type": "string"
                }
              },
              "required": [
                "ref",
                "why_relevant"
              ],
              "additionalProperties": false
            }
          },
          "leads_paths": {
            "type": "array",
            "items": {
              "type": "object",
              "properties": {
                "path_id": {
                  "type": "string"
                },
                "claim": {
                  "type": "string"
                }
              },
              "required": [
                "path_id",
                "claim"
              ],
              "additionalProperties": false
            }
          },
          "next_hops": {
            "type": "array",
            "items": {
              "type": "string"
            }
          },
          "bundle_handle": {
            "type": "string",
            "description": "Handle or id returned by bbox_bundle_evidence, when a bundle was created."
          },
          "limits": {
            "type": "array",
            "items": {
              "type": "string"
            }
          },
          "gap_check": {
            "type": "string",
            "description": "clean, blocked, disputed, or a concise unresolved gap summary."
          }
        },
        "required": [
          "tldr",
          "leads_symbols_files",
          "leads_entity_refs",
          "leads_paths",
          "next_hops",
          "bundle_handle",
          "limits",
          "gap_check"
        ],
        "additionalProperties": false
      },
      "evidence_density": "high"
    },
    "composition": {
      "chainable_after": [],
      "parallel_safe": true,
      "fan_out_aggregator": "ensemble-merge"
    },
    "cost_class": "cheap",
    "provenance": {
      "kind": "hand_authored",
      "author": "blackbox-phase-decomposer",
      "created_at": "2026-05-15T00:00:00Z"
    }
  }
}
