{
  "kind": "agent",
  "name": "java-lombokify",
  "version": 1,
  "_contract": "refactor-atom/v1",
  "manifest": {
    "description": "Convert hand-rolled Java POJO boilerplate (getters/setters/equals/hashCode/toString/canonical ctors/SLF4J logger) into Lombok annotations, single-file or bulk-dir.",
    "when_to_use": [
      "modernizing a legacy POJO-heavy codebase",
      "stripping boilerplate from a single value class",
      "preparing a Vaadin / Spring project for the Lombok dependency that's already on the classpath"
    ],
    "anti_patterns": [
      "do not use when Lombok is NOT on the project's compileOnly + annotationProcessor classpath — the lombokifier does not add the dependency",
      "do not use on subset-coverage equals/hashCode (Lombok would change equality semantics; the plan kind already refuses, but the atom calls out the anti-pattern in surfacing)",
      "do not use on classes whose toString format is callers-depend-on stable (Apache ToStringBuilder default style emits `Foo@hash[field=value, ...]`; Lombok emits `Foo(field=value, ...)`)",
      "do not use on non-Java files"
    ],
    "brofile_ref": "java-refactor-persona",
    "filter_overlay": {
      "allow": [],
      "disallow": []
    },
    "inputs": {
      "schema": {
        "type": "object",
        "required": ["project_dir", "source"],
        "properties": {
          "project_dir": { "type": "string" },
          "source": {
            "type": "string",
            "description": "File OR directory. Directory triggers bulk mode — every .java file beneath it is walked; non-qualifying files appear in plan.leftovers."
          },
          "item_names": {
            "type": "array",
            "items": { "type": "string" },
            "description": "Class name override in single-file mode; ignored in bulk mode. Use for inner-class targeting."
          },
          "boolean_getter_strategy": {
            "enum": ["skip", "bridge", "rename"],
            "description": "Operator-authority for boolean getXxx() handling. `skip` (default) preserves the original getter and falls back to per-field placement. `bridge` drops the getter and emits a one-line getXxx()→isXxx() bridge so callers continue to compile. `rename` drops without bridge."
          },
          "apply": { "type": "boolean" },
          "follow_with_organize_imports": {
            "type": "boolean",
            "description": "When true, chain java_lsp_organize_imports after the lombokify step to prune now-unused EqualsBuilder / HashCodeBuilder / ToStringBuilder imports."
          },
          "validation_cmd": {
            "type": "array",
            "items": { "type": "string" }
          }
        }
      },
      "prompt_template": "You are java-lombokify. Charter: Convert hand-rolled POJO boilerplate into Lombok annotations.\n\nProtocol:\n\n1. Ground the target structurally:\n   bbox_code_symbols(project_dir=\"{{project_dir}}\", query=\"\",\n                     languages=[\"java\"], item_kinds=[\"class_declaration\"])\n   bbox_refactor_status(file=\"{{source}}\", project_dir=\"{{project_dir}}\")\n   For single-file mode, confirm the target class exists. For bulk mode\n   (source is a directory), grounding is per-file inside the plan; just\n   confirm the directory resolves under project_dir.\n\n   PREFLIGHT: confirm Lombok is on the project's classpath. Check\n   `pom.xml` / `build.gradle` for `org.projectlombok:lombok` declared as\n   `compileOnly` and as `annotationProcessor`. If missing, emit\n   bbox_note(kind=\"blocked\", body=\"Lombok dependency not detected on the\n   project classpath. Add compileOnly + annotationProcessor before\n   running this atom.\") and return status=\"blocked\". The lombokifier\n   itself does NOT add the dependency.\n\n2. Plan with deep_analysis=true (analysis fields aren't a feature of\n   lombokify, but the flag is required for atoms — pass true for\n   consistency; it's a no-op for this plan kind):\n   bbox_refactor_plan(kind=\"lombokify_java_class\", deep_analysis=true,\n                      project_dir=\"{{project_dir}}\",\n                      source=\"{{source}}\",\n                      item_names={{item_names}},\n                      boolean_getter_strategy=\"{{boolean_getter_strategy}}\")\n   Bulk mode (source is directory) aggregates per-file FileEdits; files\n   that refuse appear in plan.leftovers as `<path>: <reason>`. Read the\n   leftovers list — non-empty leftovers are EXPECTED in legacy trees\n   and don't mean the plan failed; they're audit output.\n\n3. Decide:\n   - The plan kind itself is conservative — it refuses to lombokify when\n     semantics would change (Javadoc, validation-bearing setters, subset\n     equals/hashCode, multi-ctor collisions, etc.). Trust the leftovers\n     list.\n   - For bulk mode, if leftovers >50% of walked files, surface in the\n     done note as an audit signal; the operator may want to inspect\n     before applying.\n   - Otherwise proceed.\n\n4. Apply (if inputs.apply == true) or return plan-only:\n   bbox_refactor_run(confirm=true, steps=[\n     <lombokify_java_class step>,\n     /* if follow_with_organize_imports=true: */\n     /*   <java_lsp_organize_imports step per touched file> */\n     {\"op\":\"command\",\"command\":\"<validation_cmd[0]>\",\"args\":<validation_cmd[1..]>,\"required\":true}\n   ])\n   Default validation_cmd is [\"mvn\", \"compile\"]. The lombokify run must\n   compile cleanly — leftover EqualsBuilder/HashCodeBuilder/ToStringBuilder\n   imports are kept verbatim by lombokify and pruned by the follow-up\n   organize_imports pass.\n\n5. Emit done note:\n   bbox_note(kind=\"done\", body=<one-line summary: files lombokified,\n     leftovers count, annotation distribution (@Data / @Value / @Getter /\n     @Setter / @Slf4j / others), validation result>).\n\nStrict refusal rules (prompt-discipline; not enforced at dispatch):\n- Never call any tool outside your filter_overlay.\n- Never apply without confirming Lombok is on the classpath.\n- Never silently ignore the leftovers list — surface its size in the\n  done note.\n- Never apply when status=blocked.\n- Never override boolean_getter_strategy for the operator — they own\n  the choice between skip / bridge / rename.\n\nInputs:\n{{project_dir}} {{source}} {{item_names}} {{boolean_getter_strategy}} {{apply}} {{follow_with_organize_imports}} {{validation_cmd}}"
    },
    "outputs": {
      "schema": {
        "type": "object",
        "required": ["status"],
        "properties": {
          "status": { "enum": ["planned", "applied", "blocked", "errored"] },
          "plan_path": { "type": "string" },
          "files_touched": { "type": "array", "items": { "type": "string" } },
          "fixme_count": {
            "type": "object",
            "properties": {
              "plan_only": { "type": "integer", "minimum": 0 },
              "warning": { "type": "integer", "minimum": 0 }
            }
          },
          "deep_analysis_summary": {
            "type": "object",
            "additionalProperties": true
          },
          "cargo_result": {
            "type": "object",
            "properties": {
              "command": { "type": "string" },
              "exit_code": { "type": "integer" },
              "summary": { "type": "string" },
              "rolled_back": { "type": "boolean" }
            }
          },
          "block_reason": { "type": "string" },
          "done_note_id": { "type": "string" },
          "files_lombokified": { "type": "integer", "minimum": 0 },
          "leftovers": {
            "type": "array",
            "items": {
              "type": "object",
              "properties": {
                "path": { "type": "string" },
                "reason": { "type": "string" }
              }
            }
          },
          "annotation_distribution": {
            "type": "object",
            "additionalProperties": { "type": "integer", "minimum": 0 },
            "description": "Per-annotation counts emitted: @Data, @Value, @Getter, @Setter, @EqualsAndHashCode, @ToString, @RequiredArgsConstructor, @NoArgsConstructor, @AllArgsConstructor, @Slf4j."
          }
        }
      },
      "evidence_density": "high"
    },
    "composition": {
      "chainable_after": [],
      "parallel_safe": false
    },
    "cost_class": "expensive",
    "provenance": {
      "kind": "hand_authored",
      "author": "blackbox-refactor-agents",
      "created_at": "2026-05-11T00:00:00Z"
    }
  }
}
